{
  "schema_version": "1",
  "run": {
    "run_id": "pilot-T07-E4-claude-sonnet-4-6-suraj-001",
    "experiment_id": "pilot",
    "operator": "suraj",
    "batch_id": null,
    "replication": 1,
    "timestamp_start": "2026-06-19T19:46:48Z",
    "timestamp_end": "2026-06-19T19:50:51Z"
  },
  "condition": {
    "task_id": "T07",
    "env_id": "E4",
    "agent_id": "claude-sonnet-4-6",
    "agent_provider": "anthropic",
    "base_repo_sha": "4e09644cab6f2ac4a2b91573fb670a0546f69cd4",
    "env_overlay_hash": "sha256:f7d1b7ffa71e3e75ad35d9281bad0952c3a22e6fadeb830fac8e6f37447ecb01"
  },
  "outcome": {
    "terminal_state": "completed",
    "score_automated": 1.0,
    "score_human": null,
    "ac_results": {
      "AC1": {
        "passed": true,
        "output": "98"
      },
      "AC2": {
        "passed": true,
        "output": "ok"
      }
    }
  },
  "tokens": {
    "total_input": 38,
    "total_output": 22474,
    "cache_read": 1542700,
    "cache_write": 142700,
    "total_effective": -1365918,
    "context_acquisition": 36,
    "phase_orientation_input": 35,
    "phase_implementation_input": 2,
    "phase_verification_input": 1
  },
  "timing": {
    "wall_clock_seconds": 239.038,
    "time_to_first_edit_seconds": 225.599,
    "phase_orientation_seconds": 217.586,
    "phase_implementation_seconds": 7.811,
    "phase_verification_seconds": 5.532
  },
  "navigation": {
    "file_reads_total": 4,
    "file_reads_unique": 4,
    "nav_entropy": 2.0,
    "nav_entropy_pre_edit": 2.0,
    "files_read_sequence": [
      "routers/cowork_agent/agents.py",
      "services/cowork_agent/adapters/claude_code/agents.py",
      "services/cowork_agent/adapters/openclaw/agents.py",
      "services/cowork_agent/project_layout.py"
    ],
    "files_edited": [
      "services/cowork_agent/adapters/claude_code/agents.py"
    ],
    "memory_reads": 0,
    "memory_writes": 0,
    "xo_reads": 0,
    "agents_md_read": false,
    "project_md_read": false
  },
  "operations": {
    "tool_calls_total": 19,
    "bash_calls": 12,
    "search_calls": 7,
    "git_calls": 0,
    "web_searches": 0,
    "agent_spawns": 1,
    "replanning_events": 0,
    "message_count": 52
  },
  "token_curve": [
    [
      1,
      3
    ],
    [
      2,
      6
    ],
    [
      3,
      9
    ],
    [
      5,
      10
    ],
    [
      6,
      11
    ],
    [
      7,
      12
    ],
    [
      9,
      13
    ],
    [
      11,
      14
    ],
    [
      12,
      15
    ],
    [
      13,
      16
    ],
    [
      15,
      17
    ],
    [
      17,
      18
    ],
    [
      19,
      19
    ],
    [
      21,
      20
    ],
    [
      22,
      21
    ],
    [
      23,
      22
    ],
    [
      25,
      23
    ],
    [
      27,
      24
    ],
    [
      28,
      25
    ],
    [
      30,
      26
    ],
    [
      32,
      27
    ],
    [
      33,
      28
    ],
    [
      35,
      29
    ],
    [
      37,
      30
    ],
    [
      39,
      31
    ],
    [
      41,
      32
    ],
    [
      43,
      33
    ],
    [
      45,
      34
    ],
    [
      46,
      35
    ],
    [
      47,
      36
    ],
    [
      49,
      37
    ],
    [
      51,
      38
    ]
  ],
  "raw": {
    "transcript_path": "/Users/surshar/Programming/XO/ClaudeWorkspace/experiment-20260612/experiments/runs/pilot-T07-E4-claude-sonnet-4-6-suraj-001/transcript.jsonl",
    "patch_path": "/Users/surshar/Programming/XO/ClaudeWorkspace/experiment-20260612/experiments/runs/pilot-T07-E4-claude-sonnet-4-6-suraj-001/git.patch",
    "grade_path": "/Users/surshar/Programming/XO/ClaudeWorkspace/experiment-20260612/experiments/runs/pilot-T07-E4-claude-sonnet-4-6-suraj-001/grade.json"
  }
}