{
  "schema_version": "1",
  "run": {
    "run_id": "pilot-T03-E1-claude-sonnet-4-6-suraj-001",
    "experiment_id": "pilot",
    "operator": "suraj",
    "batch_id": null,
    "replication": 1,
    "timestamp_start": "2026-06-19T18:08:10Z",
    "timestamp_end": "2026-06-19T18:13:33Z"
  },
  "condition": {
    "task_id": "T03",
    "env_id": "E1",
    "agent_id": "claude-sonnet-4-6",
    "agent_provider": "anthropic",
    "base_repo_sha": "4e09644cab6f2ac4a2b91573fb670a0546f69cd4",
    "env_overlay_hash": "sha256:c734a14713871932a0cc4a9cfacfd8d1e7fe5ea797f357601efade42e140aefc"
  },
  "outcome": {
    "terminal_state": "partial",
    "score_automated": 0.3333333333333333,
    "score_human": null,
    "ac_results": {
      "AC1": {
        "passed": false,
        "output": "0"
      },
      "AC2": {
        "passed": true,
        "output": "ok"
      },
      "AC3": {
        "passed": false,
        "output": "0"
      }
    }
  },
  "tokens": {
    "total_input": 44,
    "total_output": 39741,
    "cache_read": 1595547,
    "cache_write": 108684,
    "total_effective": -1396207,
    "context_acquisition": 24,
    "phase_orientation_input": 23,
    "phase_implementation_input": 19,
    "phase_verification_input": 2
  },
  "timing": {
    "wall_clock_seconds": 319.607,
    "time_to_first_edit_seconds": 125.414,
    "phase_orientation_seconds": 115.606,
    "phase_implementation_seconds": 156.343,
    "phase_verification_seconds": 37.749
  },
  "navigation": {
    "file_reads_total": 6,
    "file_reads_unique": 4,
    "nav_entropy": 1.9182958340544896,
    "nav_entropy_pre_edit": 1.5219280948873621,
    "files_read_sequence": [
      "server.py",
      "routers/cowork_agent/__init__.py",
      "routers/cowork_agent/chat.py",
      "routers/cowork_agent/chat.py",
      "server.py",
      "utils/__init__.py"
    ],
    "files_edited": [
      "utils/rate_limit.py",
      "utils/__init__.py"
    ],
    "memory_reads": 0,
    "memory_writes": 0,
    "xo_reads": 0,
    "agents_md_read": false,
    "project_md_read": false
  },
  "operations": {
    "tool_calls_total": 17,
    "bash_calls": 4,
    "search_calls": 1,
    "git_calls": 0,
    "web_searches": 0,
    "agent_spawns": 1,
    "replanning_events": 0,
    "message_count": 56
  },
  "token_curve": [
    [
      1,
      3
    ],
    [
      2,
      6
    ],
    [
      3,
      9
    ],
    [
      5,
      10
    ],
    [
      6,
      11
    ],
    [
      7,
      12
    ],
    [
      9,
      13
    ],
    [
      11,
      14
    ],
    [
      13,
      15
    ],
    [
      14,
      16
    ],
    [
      15,
      17
    ],
    [
      17,
      18
    ],
    [
      18,
      19
    ],
    [
      20,
      20
    ],
    [
      21,
      21
    ],
    [
      22,
      22
    ],
    [
      24,
      23
    ],
    [
      25,
      24
    ],
    [
      27,
      25
    ],
    [
      29,
      26
    ],
    [
      30,
      27
    ],
    [
      32,
      28
    ],
    [
      34,
      29
    ],
    [
      36,
      30
    ],
    [
      37,
      31
    ],
    [
      38,
      32
    ],
    [
      40,
      33
    ],
    [
      41,
      34
    ],
    [
      42,
      35
    ],
    [
      44,
      36
    ],
    [
      46,
      37
    ],
    [
      47,
      38
    ],
    [
      48,
      39
    ],
    [
      50,
      40
    ],
    [
      51,
      41
    ],
    [
      52,
      42
    ],
    [
      54,
      43
    ],
    [
      55,
      44
    ]
  ],
  "raw": {
    "transcript_path": "/Users/surshar/Programming/XO/ClaudeWorkspace/experiment-20260612/experiments/runs/pilot-T03-E1-claude-sonnet-4-6-suraj-001/transcript.jsonl",
    "patch_path": "/Users/surshar/Programming/XO/ClaudeWorkspace/experiment-20260612/experiments/runs/pilot-T03-E1-claude-sonnet-4-6-suraj-001/git.patch",
    "grade_path": "/Users/surshar/Programming/XO/ClaudeWorkspace/experiment-20260612/experiments/runs/pilot-T03-E1-claude-sonnet-4-6-suraj-001/grade.json"
  }
}