{
  "schema_version": "1",
  "run": {
    "run_id": "pilot-T01-E2-claude-sonnet-4-6-suraj-001",
    "experiment_id": "pilot",
    "operator": "suraj",
    "batch_id": null,
    "replication": 1,
    "timestamp_start": "2026-06-19T17:18:53Z",
    "timestamp_end": "2026-06-19T17:21:32Z"
  },
  "condition": {
    "task_id": "T01",
    "env_id": "E2",
    "agent_id": "claude-sonnet-4-6",
    "agent_provider": "anthropic",
    "base_repo_sha": "4e09644cab6f2ac4a2b91573fb670a0546f69cd4",
    "env_overlay_hash": "sha256:c1a34db4c6ebeedac24dfafb3e1c7395d5b850c71e0c58b37c03983487b23f30"
  },
  "outcome": {
    "terminal_state": "partial",
    "score_automated": 0.6666666666666666,
    "score_human": null,
    "ac_results": {
      "AC1": {
        "passed": false,
        "output": "0"
      },
      "AC2": {
        "passed": true,
        "output": "ok"
      },
      "AC3": {
        "passed": true,
        "output": "1"
      }
    }
  },
  "tokens": {
    "total_input": 38,
    "total_output": 26797,
    "cache_read": 1580228,
    "cache_write": 144781,
    "total_effective": -1395370,
    "context_acquisition": 25,
    "phase_orientation_input": 24,
    "phase_implementation_input": 9,
    "phase_verification_input": 5
  },
  "timing": {
    "wall_clock_seconds": 158.097,
    "time_to_first_edit_seconds": 70.189,
    "phase_orientation_seconds": 59.261,
    "phase_implementation_seconds": 42.381,
    "phase_verification_seconds": 45.439
  },
  "navigation": {
    "file_reads_total": 7,
    "file_reads_unique": 7,
    "nav_entropy": 2.8073549220576037,
    "nav_entropy_pre_edit": 2.8073549220576037,
    "files_read_sequence": [
      "routers/status/__init__.py",
      "routers/status/models.py",
      "routers/status/providers.py",
      "server.py",
      ".env.example",
      "routers/status/channels.py",
      "requirements.txt"
    ],
    "files_edited": [
      "routers/status/deep.py"
    ],
    "memory_reads": 0,
    "memory_writes": 0,
    "xo_reads": 0,
    "agents_md_read": false,
    "project_md_read": false
  },
  "operations": {
    "tool_calls_total": 17,
    "bash_calls": 6,
    "search_calls": 3,
    "git_calls": 0,
    "web_searches": 0,
    "agent_spawns": 0,
    "replanning_events": 0,
    "message_count": 50
  },
  "token_curve": [
    [
      1,
      3
    ],
    [
      2,
      6
    ],
    [
      3,
      9
    ],
    [
      5,
      10
    ],
    [
      7,
      11
    ],
    [
      9,
      12
    ],
    [
      11,
      13
    ],
    [
      12,
      14
    ],
    [
      15,
      15
    ],
    [
      16,
      16
    ],
    [
      17,
      17
    ],
    [
      19,
      18
    ],
    [
      21,
      19
    ],
    [
      22,
      20
    ],
    [
      23,
      21
    ],
    [
      25,
      22
    ],
    [
      26,
      23
    ],
    [
      27,
      24
    ],
    [
      29,
      25
    ],
    [
      31,
      26
    ],
    [
      33,
      27
    ],
    [
      34,
      28
    ],
    [
      36,
      29
    ],
    [
      38,
      30
    ],
    [
      40,
      31
    ],
    [
      41,
      32
    ],
    [
      42,
      33
    ],
    [
      44,
      34
    ],
    [
      45,
      35
    ],
    [
      46,
      36
    ],
    [
      48,
      37
    ],
    [
      49,
      38
    ]
  ],
  "raw": {
    "transcript_path": "/Users/surshar/Programming/XO/ClaudeWorkspace/experiment-20260612/experiments/runs/pilot-T01-E2-claude-sonnet-4-6-suraj-001/transcript.jsonl",
    "patch_path": "/Users/surshar/Programming/XO/ClaudeWorkspace/experiment-20260612/experiments/runs/pilot-T01-E2-claude-sonnet-4-6-suraj-001/git.patch",
    "grade_path": "/Users/surshar/Programming/XO/ClaudeWorkspace/experiment-20260612/experiments/runs/pilot-T01-E2-claude-sonnet-4-6-suraj-001/grade.json"
  }
}