{
  "schema_version": "1",
  "run": {
    "run_id": "pilot-T06-E3-claude-sonnet-4-6-suraj-001",
    "experiment_id": "pilot",
    "operator": "suraj",
    "batch_id": null,
    "replication": 1,
    "timestamp_start": "2026-06-19T19:12:20Z",
    "timestamp_end": "2026-06-19T19:18:23Z"
  },
  "condition": {
    "task_id": "T06",
    "env_id": "E3",
    "agent_id": "claude-sonnet-4-6",
    "agent_provider": "anthropic",
    "base_repo_sha": "4e09644cab6f2ac4a2b91573fb670a0546f69cd4",
    "env_overlay_hash": "sha256:70284c6a4a3d76015262c0c535fe5340532a6c92b922f49a3c2dc85801a90002"
  },
  "outcome": {
    "terminal_state": "completed",
    "score_automated": 1.0,
    "score_human": null,
    "ac_results": {
      "AC1": {
        "passed": true,
        "output": "6"
      },
      "AC2": {
        "passed": true,
        "output": "ok"
      },
      "AC3": {
        "passed": true,
        "output": "1"
      }
    }
  },
  "tokens": {
    "total_input": 61,
    "total_output": 60746,
    "cache_read": 2791036,
    "cache_write": 131891,
    "total_effective": -2451125,
    "context_acquisition": 17,
    "phase_orientation_input": 16,
    "phase_implementation_input": 29,
    "phase_verification_input": 16
  },
  "timing": {
    "wall_clock_seconds": 362.078,
    "time_to_first_edit_seconds": 37.302,
    "phase_orientation_seconds": 36.434,
    "phase_implementation_seconds": 223.456,
    "phase_verification_seconds": 101.209
  },
  "navigation": {
    "file_reads_total": 2,
    "file_reads_unique": 2,
    "nav_entropy": 1.0,
    "nav_entropy_pre_edit": -0.0,
    "files_read_sequence": [
      "routers/cowork_agent/files.py",
      "AGENTS.md"
    ],
    "files_edited": [
      "routers/cowork_agent/files.py"
    ],
    "memory_reads": 0,
    "memory_writes": 0,
    "xo_reads": 0,
    "agents_md_read": true,
    "project_md_read": false
  },
  "operations": {
    "tool_calls_total": 29,
    "bash_calls": 15,
    "search_calls": 4,
    "git_calls": 0,
    "web_searches": 0,
    "agent_spawns": 0,
    "replanning_events": 0,
    "message_count": 85
  },
  "token_curve": [
    [
      1,
      3
    ],
    [
      2,
      6
    ],
    [
      3,
      9
    ],
    [
      5,
      10
    ],
    [
      7,
      11
    ],
    [
      8,
      12
    ],
    [
      9,
      13
    ],
    [
      11,
      14
    ],
    [
      13,
      15
    ],
    [
      14,
      16
    ],
    [
      15,
      17
    ],
    [
      17,
      18
    ],
    [
      19,
      19
    ],
    [
      21,
      20
    ],
    [
      22,
      21
    ],
    [
      24,
      22
    ],
    [
      25,
      23
    ],
    [
      27,
      24
    ],
    [
      29,
      25
    ],
    [
      31,
      26
    ],
    [
      33,
      27
    ],
    [
      35,
      28
    ],
    [
      37,
      29
    ],
    [
      39,
      30
    ],
    [
      40,
      31
    ],
    [
      41,
      32
    ],
    [
      43,
      33
    ],
    [
      44,
      34
    ],
    [
      45,
      35
    ],
    [
      47,
      36
    ],
    [
      48,
      37
    ],
    [
      49,
      38
    ],
    [
      51,
      39
    ],
    [
      52,
      40
    ],
    [
      54,
      41
    ],
    [
      56,
      42
    ],
    [
      58,
      43
    ],
    [
      59,
      44
    ],
    [
      60,
      45
    ],
    [
      62,
      46
    ],
    [
      63,
      47
    ],
    [
      64,
      48
    ],
    [
      66,
      49
    ],
    [
      67,
      50
    ],
    [
      69,
      51
    ],
    [
      71,
      52
    ],
    [
      72,
      53
    ],
    [
      73,
      54
    ],
    [
      75,
      55
    ],
    [
      76,
      56
    ],
    [
      77,
      57
    ],
    [
      79,
      58
    ],
    [
      81,
      59
    ],
    [
      83,
      60
    ],
    [
      84,
      61
    ]
  ],
  "raw": {
    "transcript_path": "/Users/surshar/Programming/XO/ClaudeWorkspace/experiment-20260612/experiments/runs/pilot-T06-E3-claude-sonnet-4-6-suraj-001/transcript.jsonl",
    "patch_path": "/Users/surshar/Programming/XO/ClaudeWorkspace/experiment-20260612/experiments/runs/pilot-T06-E3-claude-sonnet-4-6-suraj-001/git.patch",
    "grade_path": "/Users/surshar/Programming/XO/ClaudeWorkspace/experiment-20260612/experiments/runs/pilot-T06-E3-claude-sonnet-4-6-suraj-001/grade.json"
  }
}