{
  "schema_version": "1",
  "run": {
    "run_id": "pilot-T02-E5-claude-sonnet-4-6-suraj-002",
    "experiment_id": "pilot",
    "operator": "suraj",
    "batch_id": null,
    "replication": 2,
    "timestamp_start": "2026-06-20T06:58:33Z",
    "timestamp_end": "2026-06-20T07:05:49Z"
  },
  "condition": {
    "task_id": "T02",
    "env_id": "E5",
    "agent_id": "claude-sonnet-4-6",
    "agent_provider": "anthropic",
    "base_repo_sha": "4e09644cab6f2ac4a2b91573fb670a0546f69cd4",
    "env_overlay_hash": "sha256:d19aea8c96d9ff9c65579ce9a5255bfc5068d192904629850f3b135d9233366f"
  },
  "outcome": {
    "terminal_state": "partial",
    "score_automated": 0.3333333333333333,
    "score_human": null,
    "ac_results": {
      "AC1": {
        "passed": false,
        "output": "0"
      },
      "AC2": {
        "passed": false,
        "output": "0"
      },
      "AC3": {
        "passed": true,
        "output": "ok"
      }
    }
  },
  "tokens": {
    "total_input": 102,
    "total_output": 84980,
    "cache_read": 7247401,
    "cache_write": 338022,
    "total_effective": -6437578,
    "context_acquisition": 82,
    "phase_orientation_input": 81,
    "phase_implementation_input": 20,
    "phase_verification_input": 1
  },
  "timing": {
    "wall_clock_seconds": 434.958,
    "time_to_first_edit_seconds": 274.524,
    "phase_orientation_seconds": 270.658,
    "phase_implementation_seconds": 150.946,
    "phase_verification_seconds": 9.39
  },
  "navigation": {
    "file_reads_total": 12,
    "file_reads_unique": 10,
    "nav_entropy": 3.188721875540867,
    "nav_entropy_pre_edit": 3.2776134368191157,
    "files_read_sequence": [
      "PROJECT.md",
      "routers/auth/auth.py",
      "server.py",
      "routers/cowork_agent/config.py",
      "routers/auth/claude_setup_token.py",
      "utils/commands.py",
      "routers/cowork_agent/bff/xo_projects.py",
      "routers/cowork_agent/xo_projects_sync.py",
      "routers/auth/codex_setup.py",
      "routers/cowork_agent/chat.py",
      "routers/auth/auth.py",
      "routers/auth/auth.py"
    ],
    "files_edited": [
      "routers/auth/auth.py"
    ],
    "memory_reads": 0,
    "memory_writes": 0,
    "xo_reads": 0,
    "agents_md_read": false,
    "project_md_read": true
  },
  "operations": {
    "tool_calls_total": 48,
    "bash_calls": 32,
    "search_calls": 26,
    "git_calls": 0,
    "web_searches": 0,
    "agent_spawns": 0,
    "replanning_events": 0,
    "message_count": 143
  },
  "token_curve": [
    [
      1,
      3
    ],
    [
      2,
      6
    ],
    [
      3,
      9
    ],
    [
      5,
      12
    ],
    [
      7,
      13
    ],
    [
      9,
      14
    ],
    [
      11,
      15
    ],
    [
      12,
      16
    ],
    [
      13,
      17
    ],
    [
      15,
      18
    ],
    [
      17,
      19
    ],
    [
      18,
      20
    ],
    [
      19,
      21
    ],
    [
      21,
      22
    ],
    [
      23,
      23
    ],
    [
      24,
      24
    ],
    [
      25,
      25
    ],
    [
      27,
      26
    ],
    [
      29,
      27
    ],
    [
      30,
      28
    ],
    [
      31,
      29
    ],
    [
      33,
      30
    ],
    [
      35,
      31
    ],
    [
      36,
      32
    ],
    [
      38,
      33
    ],
    [
      40,
      34
    ],
    [
      41,
      35
    ],
    [
      42,
      36
    ],
    [
      44,
      37
    ],
    [
      46,
      38
    ],
    [
      47,
      39
    ],
    [
      49,
      40
    ],
    [
      51,
      41
    ],
    [
      53,
      42
    ],
    [
      55,
      43
    ],
    [
      56,
      44
    ],
    [
      57,
      45
    ],
    [
      59,
      46
    ],
    [
      61,
      47
    ],
    [
      62,
      48
    ],
    [
      63,
      49
    ],
    [
      65,
      50
    ],
    [
      67,
      51
    ],
    [
      68,
      52
    ],
    [
      69,
      53
    ],
    [
      71,
      54
    ],
    [
      73,
      55
    ],
    [
      75,
      56
    ],
    [
      76,
      57
    ],
    [
      77,
      58
    ],
    [
      79,
      59
    ],
    [
      81,
      60
    ],
    [
      82,
      61
    ],
    [
      83,
      62
    ],
    [
      85,
      63
    ],
    [
      87,
      64
    ],
    [
      88,
      65
    ],
    [
      89,
      66
    ],
    [
      91,
      67
    ],
    [
      93,
      68
    ],
    [
      94,
      69
    ],
    [
      95,
      70
    ],
    [
      97,
      71
    ],
    [
      98,
      72
    ],
    [
      99,
      73
    ],
    [
      100,
      74
    ],
    [
      103,
      75
    ],
    [
      104,
      76
    ],
    [
      105,
      77
    ],
    [
      107,
      78
    ],
    [
      108,
      79
    ],
    [
      109,
      80
    ],
    [
      111,
      81
    ],
    [
      112,
      82
    ],
    [
      114,
      83
    ],
    [
      116,
      84
    ],
    [
      117,
      85
    ],
    [
      119,
      86
    ],
    [
      120,
      87
    ],
    [
      122,
      88
    ],
    [
      123,
      89
    ],
    [
      124,
      90
    ],
    [
      126,
      91
    ],
    [
      127,
      92
    ],
    [
      129,
      93
    ],
    [
      130,
      94
    ],
    [
      132,
      95
    ],
    [
      133,
      96
    ],
    [
      135,
      97
    ],
    [
      136,
      98
    ],
    [
      138,
      99
    ],
    [
      139,
      100
    ],
    [
      140,
      101
    ],
    [
      142,
      102
    ]
  ],
  "raw": {
    "transcript_path": "/Users/surshar/Programming/XO/ClaudeWorkspace/experiment-20260612/experiments/runs/pilot-T02-E5-claude-sonnet-4-6-suraj-002/transcript.jsonl",
    "patch_path": "/Users/surshar/Programming/XO/ClaudeWorkspace/experiment-20260612/experiments/runs/pilot-T02-E5-claude-sonnet-4-6-suraj-002/git.patch",
    "grade_path": "/Users/surshar/Programming/XO/ClaudeWorkspace/experiment-20260612/experiments/runs/pilot-T02-E5-claude-sonnet-4-6-suraj-002/grade.json"
  }
}