{
  "schema_version": "1",
  "run": {
    "run_id": "pilot-T02-E4-claude-sonnet-4-6-suraj-001",
    "experiment_id": "pilot",
    "operator": "suraj",
    "batch_id": null,
    "replication": 1,
    "timestamp_start": "2026-06-19T17:50:11Z",
    "timestamp_end": "2026-06-19T17:55:35Z"
  },
  "condition": {
    "task_id": "T02",
    "env_id": "E4",
    "agent_id": "claude-sonnet-4-6",
    "agent_provider": "anthropic",
    "base_repo_sha": "4e09644cab6f2ac4a2b91573fb670a0546f69cd4",
    "env_overlay_hash": "sha256:f7d1b7ffa71e3e75ad35d9281bad0952c3a22e6fadeb830fac8e6f37447ecb01"
  },
  "outcome": {
    "terminal_state": "partial",
    "score_automated": 0.3333333333333333,
    "score_human": null,
    "ac_results": {
      "AC1": {
        "passed": false,
        "output": "0"
      },
      "AC2": {
        "passed": false,
        "output": "0"
      },
      "AC3": {
        "passed": true,
        "output": "ok"
      }
    }
  },
  "tokens": {
    "total_input": 229,
    "total_output": 36052,
    "cache_read": 5289481,
    "cache_write": 264782,
    "total_effective": -4724251,
    "context_acquisition": 220,
    "phase_orientation_input": 219,
    "phase_implementation_input": 9,
    "phase_verification_input": 1
  },
  "timing": {
    "wall_clock_seconds": 322.562,
    "time_to_first_edit_seconds": 239.332,
    "phase_orientation_seconds": 231.935,
    "phase_implementation_seconds": 67.387,
    "phase_verification_seconds": 15.741
  },
  "navigation": {
    "file_reads_total": 13,
    "file_reads_unique": 11,
    "nav_entropy": 3.3927474104487847,
    "nav_entropy_pre_edit": 3.3927474104487847,
    "files_read_sequence": [
      "AGENTS.md",
      "routers/auth/auth.py",
      "server.py",
      "routers/auth/claude_setup_token.py",
      "routers/cowork_agent/secrets.py",
      "services/cowork_agent/adapters/openclaw/paths.py",
      "services/cowork_agent/adapters/hermes/routes.py",
      "services/usage_sync.py",
      "routers/cowork_agent/xo_projects_sync.py",
      "services/cowork_agent/xo_projects_sync/github.py",
      "services/cowork_agent/adapters/hermes/routes.py",
      "requirements.txt",
      "routers/auth/auth.py"
    ],
    "files_edited": [
      "routers/auth/auth.py"
    ],
    "memory_reads": 0,
    "memory_writes": 0,
    "xo_reads": 0,
    "agents_md_read": true,
    "project_md_read": false
  },
  "operations": {
    "tool_calls_total": 45,
    "bash_calls": 28,
    "search_calls": 25,
    "git_calls": 0,
    "web_searches": 0,
    "agent_spawns": 0,
    "replanning_events": 0,
    "message_count": 115
  },
  "token_curve": [
    [
      1,
      3
    ],
    [
      2,
      6
    ],
    [
      3,
      9
    ],
    [
      4,
      12
    ],
    [
      7,
      165
    ],
    [
      9,
      166
    ],
    [
      10,
      167
    ],
    [
      11,
      168
    ],
    [
      13,
      169
    ],
    [
      15,
      170
    ],
    [
      16,
      171
    ],
    [
      17,
      172
    ],
    [
      19,
      173
    ],
    [
      21,
      174
    ],
    [
      23,
      175
    ],
    [
      25,
      176
    ],
    [
      27,
      177
    ],
    [
      28,
      178
    ],
    [
      31,
      179
    ],
    [
      32,
      180
    ],
    [
      33,
      181
    ],
    [
      35,
      182
    ],
    [
      37,
      183
    ],
    [
      39,
      184
    ],
    [
      41,
      185
    ],
    [
      43,
      186
    ],
    [
      45,
      187
    ],
    [
      47,
      188
    ],
    [
      49,
      189
    ],
    [
      51,
      190
    ],
    [
      53,
      191
    ],
    [
      54,
      192
    ],
    [
      56,
      193
    ],
    [
      58,
      194
    ],
    [
      59,
      195
    ],
    [
      61,
      196
    ],
    [
      63,
      197
    ],
    [
      64,
      198
    ],
    [
      66,
      199
    ],
    [
      68,
      200
    ],
    [
      69,
      201
    ],
    [
      71,
      202
    ],
    [
      73,
      203
    ],
    [
      74,
      204
    ],
    [
      76,
      205
    ],
    [
      78,
      206
    ],
    [
      79,
      207
    ],
    [
      80,
      208
    ],
    [
      82,
      209
    ],
    [
      83,
      210
    ],
    [
      85,
      211
    ],
    [
      87,
      212
    ],
    [
      88,
      213
    ],
    [
      90,
      214
    ],
    [
      92,
      215
    ],
    [
      93,
      216
    ],
    [
      95,
      217
    ],
    [
      96,
      218
    ],
    [
      97,
      219
    ],
    [
      99,
      220
    ],
    [
      101,
      221
    ],
    [
      103,
      222
    ],
    [
      104,
      223
    ],
    [
      106,
      224
    ],
    [
      108,
      225
    ],
    [
      109,
      226
    ],
    [
      110,
      227
    ],
    [
      112,
      228
    ],
    [
      114,
      229
    ]
  ],
  "raw": {
    "transcript_path": "/Users/surshar/Programming/XO/ClaudeWorkspace/experiment-20260612/experiments/runs/pilot-T02-E4-claude-sonnet-4-6-suraj-001/transcript.jsonl",
    "patch_path": "/Users/surshar/Programming/XO/ClaudeWorkspace/experiment-20260612/experiments/runs/pilot-T02-E4-claude-sonnet-4-6-suraj-001/git.patch",
    "grade_path": "/Users/surshar/Programming/XO/ClaudeWorkspace/experiment-20260612/experiments/runs/pilot-T02-E4-claude-sonnet-4-6-suraj-001/grade.json"
  }
}